url,name,address,city,state,phone
https://thomsonaccountants.com/,Results,"ÓÉą451 Hoosick Rd, Troy, NY 12180",Troy,NY,Óāį(518) 272-1800
https://www.facebook.com/people/DiFusco-Bookkeeping/61586581851070/,Results,"ÓÉąBabcock Lake Rd, Hoosick Falls, NY 12090",Hoosick Falls,NY,Óāį(518) 496-2005
https://hoosicklaw.com/,Results,"ÓÉą12 Main St, Hoosick Falls, NY 12090",Hoosick Falls,NY,Óāį(518) 686-7324
https://www.scottstackrow.com/?utm_source=google&utm_medium=google_business_profile&utm_campaign=website_click,Results,"ÓÉą314 Hoosick St, Troy, NY 12180",Troy,NY,Óāį(518) 274-9081
https://hoosickfallsjewelry.com/,Results,"ÓÉą16 John St, Hoosick Falls, NY 12090",Hoosick Falls,NY,Óāį(518) 658-3264
http://www.withtaxes.com/,Results,"ÓÉą185 Main Ave, Wynantskill, NY 12198",Wynantskill,NY,Óāį(518) 273-5676
http://lkremercpa.com/,Results,"ÓÉą32 Bank St, Bennington, VT 05201",Bennington,VT,Óāį(732) 822-6890
http://www.mattisonaccounting.com/,Results,"ÓÉą252 Union St, Bennington, VT 05201",Bennington,VT,Óāį(802) 442-9183
http://www.ejglaw.com/?utm_source=google&utm_medium=organic&utm_campaign=gbp-hoosick,Results,"ÓÉą5 Main St, Hoosick Falls, NY 12090",Hoosick Falls,NY,Óāį(518) 686-4331
http://ejjcpa.com/,Results,"ÓÉą309 North St, Bennington, VT 05201",Bennington,VT,Óāį(802) 442-2468
https://www.gublercpa.com/,Results,,Hoosick Falls,NY,Óāį(518) 650-1776
https://www.facebook.com/profile.php?id=100085222895952,Results,"ÓÉą25 Carey Ave, Hoosick Falls, NY 12090",Hoosick Falls,NY,Óāį(518) 205-5444
http://www.mcneillysgreenhouse.com/?Yext=38-2994AA,Results,"ÓÉą5421 NY-7, Hoosick Falls, NY 12090",Hoosick Falls,NY,Óāį(518) 530-7941
http://www.culnanagency.com/,Results,"ÓÉą60 Classic St, Hoosick Falls, NY 12090",Hoosick Falls,NY,Óāį(518) 686-7494
http://www.hedleycpa.com/,Results,"ÓÉą1593 US-9, Clifton Park, NY 12065",Clifton Park,NY,Óāį(518) 348-2079
https://stiddcpa.com/,Results,"ÓÉą11 South St, Glens Falls, NY 12801",Glens Falls,NY,Óāį(518) 414-3242
http://www.fallsviewtax.com/,Results,"ÓÉą41 W Main St, Honeoye Falls, NY 14472",Honeoye Falls,NY,Óāį(585) 624-9699
https://www.simmonsfinancialpartners.com/tax,Results,"ÓÉą210 South St 1st Floor, Bennington, VT 05201",Bennington,VT,Óāį(802) 753-7385
